id,title,authors,published_date,url,pdf
2310.15181v3,Poisson structure and Integrability of a Hamiltonian flow for the inhomogeneous six-vertex model,Pete Rigas,2023-10-20,http://arxiv.org/abs/2310.15181v3,http://arxiv.org/pdf/2310.15181v3
2310.12596v1,The moduli space of flat maximal space-like embeddings in pseudo-hyperbolic space,"Nicholas Rungi, Andrea Tamburelli",2023-10-19,http://arxiv.org/abs/2310.12596v1,http://arxiv.org/pdf/2310.12596v1
2310.11359v2,Local exotic tori,Joé Brendel,2023-10-17,http://arxiv.org/abs/2310.11359v2,http://arxiv.org/pdf/2310.11359v2
2310.08428v1,"$SG$-classes, Singular Symplectic Geometry and Order-preserving Isomorphisms",Alessandro Pietro Contini,2023-10-12,http://arxiv.org/abs/2310.08428v1,http://arxiv.org/pdf/2310.08428v1
2310.02912v1,Positivity for toric Kac polynomials in higher depth,Tanguy Vernet,2023-10-04,http://arxiv.org/abs/2310.02912v1,http://arxiv.org/pdf/2310.02912v1
2310.02615v1,Bifurcation of closed orbits of Hamiltonian systems with application to geodesics of the Schwarzschild metric,"Alberto Boscaggin, Walter Dambrosio, Guglielmo Feltrin",2023-10-04,http://arxiv.org/abs/2310.02615v1,http://arxiv.org/pdf/2310.02615v1
2310.01710v1,"Symplectic structure, product structures and complex structures on Leibniz algebras","Rong Tang, Nanyan Xu, Yunhe Sheng",2023-10-03,http://arxiv.org/abs/2310.01710v1,http://arxiv.org/pdf/2310.01710v1
2310.00286v2,Linear stability of the elliptic relative equilibria for the restricted N-body problem: two special cases,"Jiashengliang Xie, Bowen Liu, Qinglong Zhou",2023-09-30,http://arxiv.org/abs/2310.00286v2,http://arxiv.org/pdf/2310.00286v2
2309.17356v3,On particular integrability for (co)symplectic and (co)contact Hamiltonian systems,"R. Azuaje, A. M. Escobar-Ruiz",2023-09-29,http://arxiv.org/abs/2309.17356v3,http://arxiv.org/pdf/2309.17356v3
2309.14105v1,Lie Groupoids,"Henrique Bursztyn, Matias del Hoyo",2023-09-25,http://arxiv.org/abs/2309.14105v1,http://arxiv.org/pdf/2309.14105v1
2309.11794v1,Some observations on deformed Donaldson-Thomas connections,Kotaro Kawai,2023-09-21,http://arxiv.org/abs/2309.11794v1,http://arxiv.org/pdf/2309.11794v1
2309.10996v1,Hamilton Lie algebroids over Dirac structures and sigma models,Noriaki Ikeda,2023-09-20,http://arxiv.org/abs/2309.10996v1,http://arxiv.org/pdf/2309.10996v1
2309.09432v1,Entire solutions of two-convex Lagrangian mean curvature flows,"Chung-Jun Tsai, Mao-Pei Tsui, Mu-Tao Wang",2023-09-18,http://arxiv.org/abs/2309.09432v1,http://arxiv.org/pdf/2309.09432v1
2309.06214v1,On the symplectic structure over the moduli space of projective structures on a surface,Indranil Biswas,2023-09-12,http://arxiv.org/abs/2309.06214v1,http://arxiv.org/pdf/2309.06214v1
2309.05580v2,Deformations of Lagrangian $NQ$-submanifolds,"Miquel Cueca, Jonas Schnitzer",2023-09-11,http://arxiv.org/abs/2309.05580v2,http://arxiv.org/pdf/2309.05580v2
2309.05012v2,Canonical coordinates for moduli spaces of rank two irregular connections on curves,"Arata Komyo, Frank Loray, Masa-Hiko Saito, Szilard Szabo",2023-09-10,http://arxiv.org/abs/2309.05012v2,http://arxiv.org/pdf/2309.05012v2
2309.04885v4,Symplectic Structure-Aware Hamiltonian (Graph) Embeddings,"Jiaxu Liu, Xinping Yi, Tianle Zhang, Xiaowei Huang",2023-09-09,http://arxiv.org/abs/2309.04885v4,http://arxiv.org/pdf/2309.04885v4
2309.02513v4,Smooth transformations and ruling out closed orbits in planar systems,"Tiemo Pedergnana, Nicolas Noiray",2023-09-05,http://arxiv.org/abs/2309.02513v4,http://arxiv.org/pdf/2309.02513v4
2309.01747v4,The HHMP decomposition of the permutohedron and degenerations of torus orbits in flag varieties,Carl Lian,2023-09-04,http://arxiv.org/abs/2309.01747v4,http://arxiv.org/pdf/2309.01747v4
2309.00527v1,Quantitative characterization in contact Hamiltonian dynamics -- I,"Danijel Djordjević, Igor Uljarević, Jun Zhang",2023-09-01,http://arxiv.org/abs/2309.00527v1,http://arxiv.org/pdf/2309.00527v1
2308.16331v1,Symmetry Preservation in Hamiltonian Systems: Simulation and Learning,"Miguel Vaquero, Jorge Cortés, David Martín de Diego",2023-08-30,http://arxiv.org/abs/2308.16331v1,http://arxiv.org/pdf/2308.16331v1
2308.15349v1,Lie-Poisson Neural Networks (LPNets): Data-Based Computing of Hamiltonian Systems with Symmetries,"Christopher Eldred, François Gay-Balmaz, Sofiia Huraka, Vakhtang Putkaradze",2023-08-29,http://arxiv.org/abs/2308.15349v1,http://arxiv.org/pdf/2308.15349v1
2401.03356v2,Hamiltonian isotopies of relatively exact Lagrangians are orientation-preserving,Jack Smith,2023-08-26,http://arxiv.org/abs/2401.03356v2,http://arxiv.org/pdf/2401.03356v2
2308.12333v2,Elliptic Stable Envelopes for Certain Non-Symplectic Varieties and Dynamical $R$-Matrices for Superspin Chains from the Bethe/Gauge Correspondence,"Nafiz Ishtiaque, Seyed Faroogh Moosavian, Yehao Zhou",2023-08-23,http://arxiv.org/abs/2308.12333v2,http://arxiv.org/pdf/2308.12333v2
2308.10125v2,mKdV-Related Flows for Legendrian Curves in the Pseudohermitian 3-Sphere,"Annalisa Calini, Thomas Ivey, Emilio Musso",2023-08-19,http://arxiv.org/abs/2308.10125v2,http://arxiv.org/pdf/2308.10125v2
2308.07637v3,"A review on coisotropic reduction in Symplectic, Cosymplectic, Contact and Co-contact Hamiltonian systems","Manuel de León, Rubén Izquierdo-López",2023-08-15,http://arxiv.org/abs/2308.07637v3,http://arxiv.org/pdf/2308.07637v3
2308.05086v4,"Aspherical Lagrangian submanifolds, Audin's conjecture and cyclic dilations",Yin Li,2023-08-09,http://arxiv.org/abs/2308.05086v4,http://arxiv.org/pdf/2308.05086v4
2308.04210v3,Derived symplectic geometry,Damien Calaque,2023-08-08,http://arxiv.org/abs/2308.04210v3,http://arxiv.org/pdf/2308.04210v3
2308.03611v4,On global attraction to solitons for 3D Maxwell-Lorentz equations,E. A. Kopylova,2023-08-07,http://arxiv.org/abs/2308.03611v4,http://arxiv.org/pdf/2308.03611v4
2308.01636v1,On non-displaceable Lagrangian submanifolds in two-step flag varieties,Yoosik Kim,2023-08-03,http://arxiv.org/abs/2308.01636v1,http://arxiv.org/pdf/2308.01636v1
2308.00990v1,Contact formalism for dissipative mechanical systems on Lie algebroids,"Alexandre Anahory Simoes, Leonardo Colombo, Manuel de Leon, Modesto Salgado, Silvia Souto",2023-08-02,http://arxiv.org/abs/2308.00990v1,http://arxiv.org/pdf/2308.00990v1
2307.14690v5,A Kodaira type conjecture on almost complex 4 manifolds,Dexie Lin,2023-07-27,http://arxiv.org/abs/2307.14690v5,http://arxiv.org/pdf/2307.14690v5
2307.14955v1,Boundary structure of the standard model coupled to gravity,"Giovanni Canepa, Alberto S. Cattaneo, Filippo Fila-Robattino, Manuel Tecchiolli",2023-07-27,http://arxiv.org/abs/2307.14955v1,http://arxiv.org/pdf/2307.14955v1
2307.15210v1,Integrable scattering theory with higher derivative Hamiltonians,"Andreas Fring, Bethan Turner",2023-07-27,http://arxiv.org/abs/2307.15210v1,http://arxiv.org/pdf/2307.15210v1
2307.13389v2,"Totally geodesic Lagrangian submanifolds of the pseudo-nearly KĂ¤hler $\mathrm{SL}(2,\mathbb{R})\times\mathrm{SL}(2,\mathbb{R})$","Mateo Anarella, Joeri Van der Veken",2023-07-25,http://arxiv.org/abs/2307.13389v2,http://arxiv.org/pdf/2307.13389v2
2307.09235v1,"Nonlinear feedback, double bracket dissipation and port control of Lie-Poisson systems",Simon Hochgerner,2023-07-18,http://arxiv.org/abs/2307.09235v1,http://arxiv.org/pdf/2307.09235v1
2307.08128v1,Minimal surfaces and Colding-Minicozzi entropy in complex hyperbolic space,"Jacob Bernstein, Arunima Bhattacharya",2023-07-16,http://arxiv.org/abs/2307.08128v1,http://arxiv.org/pdf/2307.08128v1
2307.06663v1,Wonderful varieties with a view towards Poisson geometry,Ana Balibanu,2023-07-13,http://arxiv.org/abs/2307.06663v1,http://arxiv.org/pdf/2307.06663v1
2307.06232v2,Hamiltonian stochastic Lie systems and applications,"E. Fernández-Saiz, J. de Lucas, X. Rivas, M. Zajac",2023-07-12,http://arxiv.org/abs/2307.06232v2,http://arxiv.org/pdf/2307.06232v2
2307.04666v2,Phase space for gravity with boundaries,Alberto S. Cattaneo,2023-07-10,http://arxiv.org/abs/2307.04666v2,http://arxiv.org/pdf/2307.04666v2
2307.04177v3,Kirillov structures and reduction of Hamiltonian systems by scaling and standard symmetries,"A. Bravetti, S. Grillo, J. C. Marrero, E. Padron",2023-07-09,http://arxiv.org/abs/2307.04177v3,http://arxiv.org/pdf/2307.04177v3
2307.02290v3,The unbounded Lagrangian spectral norm and wrapped Floer cohomology,Wenmin Gong,2023-07-05,http://arxiv.org/abs/2307.02290v3,http://arxiv.org/pdf/2307.02290v3
2306.17349v1,Isomorphisms of Symplectic Torus Quotients,"Hans-Christian Herbig, Gerald W. Schwarz, Christopher Seaton",2023-06-30,http://arxiv.org/abs/2306.17349v1,http://arxiv.org/pdf/2306.17349v1
2306.17661v2,Shifted Contact Structures on Differentiable Stacks,"Antonio Maglio, Alfonso G. Tortorella, Luca Vitagliano",2023-06-30,http://arxiv.org/abs/2306.17661v2,http://arxiv.org/pdf/2306.17661v2
2306.15312v3,Torus-equivariantly embedded toric manifolds associated to affine subspaces,Kentaro Yamaguchi,2023-06-27,http://arxiv.org/abs/2306.15312v3,http://arxiv.org/pdf/2306.15312v3
2306.14819v2,Cuplength estimates for time-periodic measures of Hamiltonian systems with diffusion,Oliver Fabert,2023-06-26,http://arxiv.org/abs/2306.14819v2,http://arxiv.org/pdf/2306.14819v2
2306.15108v1,Scaling symmetries and canonoid transformations in Hamiltonian systems,"R. Azuaje, A. Bravetti",2023-06-26,http://arxiv.org/abs/2306.15108v1,http://arxiv.org/pdf/2306.15108v1
2306.12573v1,Symbolic integration on planar differential foliations,Thierry Combot,2023-06-21,http://arxiv.org/abs/2306.12573v1,http://arxiv.org/pdf/2306.12573v1
2306.11442v1,Kodaira-Spencer classes and geometry of canonical curves,Igor Reider,2023-06-20,http://arxiv.org/abs/2306.11442v1,http://arxiv.org/pdf/2306.11442v1
2306.09898v2,An equivariant Reeb-Beltrami correspondence and the Kepler-Euler flow,"Josep Fontana-McNally, Eva Miranda, Daniel Peralta-Salas",2023-06-16,http://arxiv.org/abs/2306.09898v2,http://arxiv.org/pdf/2306.09898v2
2306.08556v2,On Darboux theorems for geometric structures induced by closed forms,"Xavier Gràcia, Javier de Lucas, Xavier Rivas, Narciso Román-Roy",2023-06-14,http://arxiv.org/abs/2306.08556v2,http://arxiv.org/pdf/2306.08556v2
2306.06896v2,On the Cauchy problem for the Fadaray tensor on globally hyperbolic manifolds with timelike boundary,"Nicoló Drago, Nicolas Ginoux, Simone Murro",2023-06-12,http://arxiv.org/abs/2306.06896v2,http://arxiv.org/pdf/2306.06896v2
2306.04258v2,Bifurcations of Riemann Ellipsoids,"Fahimeh Mokhtari, Jesús F. Palacián, Patricia Yanguas",2023-06-07,http://arxiv.org/abs/2306.04258v2,http://arxiv.org/pdf/2306.04258v2
2306.04761v1,Reverse isoperimetric inequalities for Lagrangian intersection Floer theory,"Jean-Philippe ChassĂŠ, Jeff Hicks, Yoon Jae Nick Nho",2023-06-07,http://arxiv.org/abs/2306.04761v1,http://arxiv.org/pdf/2306.04761v1
2306.02004v1,BV Algebras with Applications to Lie Bialgebras and Poisson Cohomology,"Marco A. Farinati, A. Patricia Jancsa",2023-06-03,http://arxiv.org/abs/2306.02004v1,http://arxiv.org/pdf/2306.02004v1
2306.01508v2,Graded geometry and generalized reduction,"Henrique Bursztyn, Alberto S. Cattaneo, Rajan Amit Mehta, Marco Zambon",2023-06-02,http://arxiv.org/abs/2306.01508v2,http://arxiv.org/pdf/2306.01508v2
2306.01170v1,The Equivariant Spectral Flow and Bifurcation for Functionals with Symmetries -- Part I,"Marek Izydorek, Joanna Janczewska, Maciej Starostka, Nils Waterstraat",2023-06-01,http://arxiv.org/abs/2306.01170v1,http://arxiv.org/pdf/2306.01170v1
2305.17759v1,On a remark by Alan Weinstein,Iakovos Androulidakis,2023-05-28,http://arxiv.org/abs/2305.17759v1,http://arxiv.org/pdf/2305.17759v1
2305.14922v1,Finite reservoirs and irreversibility corrections to Hamiltonian systems statistics,"Matteo Colangeli, Antonio Di Francesco, Lamberto Rondoni",2023-05-24,http://arxiv.org/abs/2305.14922v1,http://arxiv.org/pdf/2305.14922v1
2305.15490v2,Symplectic model reduction of Hamiltonian systems using data-driven quadratic manifolds,"Harsh Sharma, Hongliang Mu, Patrick Buchfink, Rudy Geelen, Silke Glas, Boris Kramer",2023-05-24,http://arxiv.org/abs/2305.15490v2,http://arxiv.org/pdf/2305.15490v2
2305.11783v1,Bordism classes of loops and Floer's equation in cotangent bundles,"Filip Broćić, Dylan Cant",2023-05-19,http://arxiv.org/abs/2305.11783v1,http://arxiv.org/pdf/2305.11783v1
2305.09912v7,On knot types of clean Lagrangian intersections in $T^*\mathbb{R}^3$,Yukihiro Okamoto,2023-05-17,http://arxiv.org/abs/2305.09912v7,http://arxiv.org/pdf/2305.09912v7
2305.09932v1,Volume functionals on pseudoconvex hypersurfaces,"Simon Donaldson, Fabian Lehmann",2023-05-17,http://arxiv.org/abs/2305.09932v1,http://arxiv.org/pdf/2305.09932v1
2305.06844v4,Partial separability and symplectic-Haantjes manifolds,"Daniel Reyes, Piergiulio Tempesta, Giorgio Tondo",2023-05-11,http://arxiv.org/abs/2305.06844v4,http://arxiv.org/pdf/2305.06844v4
2305.06304v1,On the derivation of new non-classical hydrodynamic equations for Hamiltonian particle systems,"Raffaele Esposito, Rossana Marra",2023-05-10,http://arxiv.org/abs/2305.06304v1,http://arxiv.org/pdf/2305.06304v1
2305.05545v1,Convolution for quiver varieties via cup product on a Morse complex,Graeme Wilkin,2023-05-09,http://arxiv.org/abs/2305.05545v1,http://arxiv.org/pdf/2305.05545v1
2305.05540v1,Direct Poisson neural networks: Learning non-symplectic mechanical systems,"Martin Šípka, Michal Pavelka, Oğul Esen, Miroslav Grmela",2023-05-07,http://arxiv.org/abs/2305.05540v1,http://arxiv.org/pdf/2305.05540v1
2305.03580v1,Generalized Geometry of 2D Incompressible Fluid Flows,Radek Suchánek,2023-05-05,http://arxiv.org/abs/2305.03580v1,http://arxiv.org/pdf/2305.03580v1
2305.03553v1,Introduction to contact complete integrability,Senne Ignoul,2023-05-05,http://arxiv.org/abs/2305.03553v1,http://arxiv.org/pdf/2305.03553v1
2305.03131v1,Courant-Nijenhuis algebroids,"Henrique Bursztyn, Thiago Drummond, Clarice Netto",2023-05-04,http://arxiv.org/abs/2305.03131v1,http://arxiv.org/pdf/2305.03131v1
2305.01814v3,On the symplectic geometry of $A_k$ singularities,"Nikolay Martynchuk, San Vũ Ngoc",2023-05-02,http://arxiv.org/abs/2305.01814v3,http://arxiv.org/pdf/2305.01814v3
2305.01370v2,Persistence K-theory,"Paul Biran, Octav Cornea, Jun Zhang",2023-05-02,http://arxiv.org/abs/2305.01370v2,http://arxiv.org/pdf/2305.01370v2
2305.00409v1,Segre embedding and biharmonicity,"Hiba Bibi, Dorel Fetcu, Cezar Oniciuc",2023-04-30,http://arxiv.org/abs/2305.00409v1,http://arxiv.org/pdf/2305.00409v1
2304.14624v1,Generalized Euler angles for a unitary control of the Hamiltonian system,"Seungjin Lee, Kyunghyun Baek, Jeongho Bang",2023-04-28,http://arxiv.org/abs/2304.14624v1,http://arxiv.org/pdf/2304.14624v1
2304.12581v2,On particular integrability in classical mechanics,"A. M. Escobar-Ruiz, R. Azuaje",2023-04-25,http://arxiv.org/abs/2304.12581v2,http://arxiv.org/pdf/2304.12581v2
2304.12103v2,Stability of fixed points of Dirac structures,"Karandeep Jandu Singh, Marco Zambon",2023-04-24,http://arxiv.org/abs/2304.12103v2,http://arxiv.org/pdf/2304.12103v2
2304.13035v2,Tuning the separability in noncommutative space,Pinaki Patra,2023-04-24,http://arxiv.org/abs/2304.13035v2,http://arxiv.org/pdf/2304.13035v2
2304.10969v1,Equivariant Fukaya categories at singular values,"Yanki Lekili, Ed Segal",2023-04-21,http://arxiv.org/abs/2304.10969v1,http://arxiv.org/pdf/2304.10969v1
2304.10035v2,Derivation of Painlevé type system with $D_4^{(1)}$ affine Weyl group symmetry in a self-similarity limit,"H. Aratyn, J. F. Gomes, G. V. Lobo, A. H. Zimerman",2023-04-20,http://arxiv.org/abs/2304.10035v2,http://arxiv.org/pdf/2304.10035v2
2304.09633v1,Hamiltonian dynamics on the symplectic extended phase space for autonomous and non-autonomous systems,Jürgen Struckmeier,2023-04-19,http://arxiv.org/abs/2304.09633v1,http://arxiv.org/pdf/2304.09633v1
2304.08843v2,Exact solutions and superposition rules for Hamiltonian systems generalizing time-dependent SIS epidemic models with stochastic fluctuations,"Rutwig Campoamor-Stursberg, Eduardo Fernandez-Saiz, Francisco J. Herranz",2023-04-18,http://arxiv.org/abs/2304.08843v2,http://arxiv.org/pdf/2304.08843v2
2304.07618v3,Local H-Principles for Partial Holomorphic Relations,"Luis Giraldo, Guillermo Sánchez Arellano",2023-04-15,http://arxiv.org/abs/2304.07618v3,http://arxiv.org/pdf/2304.07618v3
2304.07631v1,Construction of solutions of analogs of the Schrodinger time equations corresponding to the Hamiltonian system $H^{2+2+1}$,V. A. Pavlenko,2023-04-13,http://arxiv.org/abs/2304.07631v1,http://arxiv.org/pdf/2304.07631v1
2304.05158v2,Complex Dirac structures with constant real index on flag manifolds,"Cristian Ortiz, Carlos Varea",2023-04-11,http://arxiv.org/abs/2304.05158v2,http://arxiv.org/pdf/2304.05158v2
2304.04500v1,Liouville integrable binomial Hamiltonian system,Mustafa Mullahasanoglu,2023-04-10,http://arxiv.org/abs/2304.04500v1,http://arxiv.org/pdf/2304.04500v1
2304.03503v3,Hamiltonian Lie algebroids over Poisson manifolds,"Christian Blohmann, Stefano Ronchi, Alan Weinstein",2023-04-07,http://arxiv.org/abs/2304.03503v3,http://arxiv.org/pdf/2304.03503v3
2304.00877v3,On the well-posed variational principle in degenerate point particle systems using embeddings of the symplectic manifold,Kyosuke Tomonari,2023-04-03,http://arxiv.org/abs/2304.00877v3,http://arxiv.org/pdf/2304.00877v3
2304.01149v2,The universal structure of moment maps in complex geometry,"Ruadhaí Dervan, Michael Hallam",2023-04-03,http://arxiv.org/abs/2304.01149v2,http://arxiv.org/pdf/2304.01149v2
2310.06088v1,Relational Composition of Physical Systems: A Categorical Approach,Owen Lynch,2023-04-01,http://arxiv.org/abs/2310.06088v1,http://arxiv.org/pdf/2310.06088v1
2303.17639v1,Balanced loss-gain induced chaos in a periodic Toda lattice,"Puspendu Roy, Pijush K. Ghosh",2023-03-30,http://arxiv.org/abs/2303.17639v1,http://arxiv.org/pdf/2303.17639v1
2303.15883v1,Numerical Methods in Poisson Geometry and their Application to Mechanics,"Oscar Cosserat, Camille Laurent-Gengoux, Vladimir Salnikov",2023-03-28,http://arxiv.org/abs/2303.15883v1,http://arxiv.org/pdf/2303.15883v1
2303.14493v1,Integrability and trajectory confinement in $\mathcal{PT}$-symmetric waveguide arrays,"I V Barashenkov, Frank Smuts, Alexander Chernyavsky",2023-03-25,http://arxiv.org/abs/2303.14493v1,http://arxiv.org/pdf/2303.14493v1
2303.13291v2,Extremal Black Holes as Relativistic Systems with Kepler Dynamics,"Dijs de Neeling, Diederik Roest, Marcello Seri, Holger Waalkens",2023-03-23,http://arxiv.org/abs/2303.13291v2,http://arxiv.org/pdf/2303.13291v2
2303.12508v1,Classification of orbit closures in the variety of 4-dimensional symplectic Lie algebras,"Edison Alberto Fernández-Culma, Nadina Elizabeth Rojas",2023-03-22,http://arxiv.org/abs/2303.12508v1,http://arxiv.org/pdf/2303.12508v1
2303.10723v8,Reconstructing real algebraic maps locally like moment-maps with prescribed images and compositions with the canonical projections to the $1$-dimensional real affine space,Naoki Kitazawa,2023-03-19,http://arxiv.org/abs/2303.10723v8,http://arxiv.org/pdf/2303.10723v8
2303.09480v1,Pseudo-Holomorphic Hamiltonian Systems,Luiz Frederic Wagner,2023-03-16,http://arxiv.org/abs/2303.09480v1,http://arxiv.org/pdf/2303.09480v1
2303.08990v2,Notes on the $L_\infty$-approach to local gauge field theories,"Maxim Grigoriev, Dmitry Rudinsky",2023-03-15,http://arxiv.org/abs/2303.08990v2,http://arxiv.org/pdf/2303.08990v2
2303.08034v1,Discrete gradient methods for irreversible port-Hamiltonian systems,"Alexandre Anahory Simoes, David Martín de Diego, Bernhard Maschke",2023-03-14,http://arxiv.org/abs/2303.08034v1,http://arxiv.org/pdf/2303.08034v1
2303.07835v2,Generalized complex structure on certain principal torus bundles,"Debjit Pal, Mainak Poddar",2023-03-14,http://arxiv.org/abs/2303.07835v2,http://arxiv.org/pdf/2303.07835v2
2303.06934v1,Study of ideal gases in curved spacetimes,"Luis Aragón-Muñoz, Hernando Quevedo",2023-03-13,http://arxiv.org/abs/2303.06934v1,http://arxiv.org/pdf/2303.06934v1
2303.06325v1,Dynamics of the infinite discrete nonlinear Schrödinger equation,Aleksis Vuoksenmaa,2023-03-11,http://arxiv.org/abs/2303.06325v1,http://arxiv.org/pdf/2303.06325v1
2303.05494v1,A Formal Equivalence of Deformation Quantization and Geometric Quantization (of Higher Groupoids) and Non-Perturbative Sigma Models,Joshua Lackman,2023-03-09,http://arxiv.org/abs/2303.05494v1,http://arxiv.org/pdf/2303.05494v1
2303.04200v3,Stratified Vector Bundles: Examples and Constructions,Ethan Ross,2023-03-07,http://arxiv.org/abs/2303.04200v3,http://arxiv.org/pdf/2303.04200v3
2303.03531v4,Null Hamiltonian Yang-Mills theory: Soft symmetries and memory as superselection,"Aldo Riello, Michele Schiavina",2023-03-06,http://arxiv.org/abs/2303.03531v4,http://arxiv.org/pdf/2303.03531v4
2302.13270v1,Integrable Systems Arising from Separation of Variables on $S^{3}$,"Diana M. H. Nguyen, Sean R. Dawson, Holger R. Dullin",2023-02-26,http://arxiv.org/abs/2302.13270v1,http://arxiv.org/pdf/2302.13270v1
2302.12273v1,Linking the ADM formulation to other Hamiltonian formulations of general relativity,"Merced Montesinos, Jorge Romero",2023-02-23,http://arxiv.org/abs/2302.12273v1,http://arxiv.org/pdf/2302.12273v1
2302.12061v4,Liouville-Arnold theorem for homogeneous symplectic and contact Hamiltonian systems,"Leonardo Colombo, Manuel de LeÃ³n, Manuel Lainz, Asier LÃ³pez-GordÃ³n",2023-02-23,http://arxiv.org/abs/2302.12061v4,http://arxiv.org/pdf/2302.12061v4
2302.11604v2,Monge-Ampere Geometry and Vortices,"Lewis Napper, Ian Roulstone, Vladimir Rubtsov, Martin Wolf",2023-02-22,http://arxiv.org/abs/2302.11604v2,http://arxiv.org/pdf/2302.11604v2
2302.10221v2,Family of Gaussian wavepacket dynamics methods from the perspective of a nonlinear Schrödinger equation,Jiří J. L. Vaníček,2023-02-20,http://arxiv.org/abs/2302.10221v2,http://arxiv.org/pdf/2302.10221v2
2302.09894v2,A Riemann-Roch formula for singular reductions by circle actions,"Benjamin Delarue, Louis Ioos, Pablo Ramacher",2023-02-20,http://arxiv.org/abs/2302.09894v2,http://arxiv.org/pdf/2302.09894v2
2302.09638v3,Symmetric spaces as adjoint orbits and their geometries,"Leonardo F. Cavenaghi, Carolina Garcia, Lino Grama, Luiz San Martin",2023-02-19,http://arxiv.org/abs/2302.09638v3,http://arxiv.org/pdf/2302.09638v3
2302.08193v4,Compatible $E$-Differential Forms on Lie Algebroids over (Pre-)Multisymplectic Manifolds,Noriaki Ikeda,2023-02-16,http://arxiv.org/abs/2302.08193v4,http://arxiv.org/pdf/2302.08193v4
2302.07441v3,Geometric Phases of Nonlinear Elastic $N$-Rotors via Cartan's Moving Frames,"Francesco Fedele, Arash Yavari",2023-02-15,http://arxiv.org/abs/2302.07441v3,http://arxiv.org/pdf/2302.07441v3
2302.07488v1,Fukaya category of infinite-type surfaces,"Jaeyoung Choi, Yong-Geun Oh",2023-02-15,http://arxiv.org/abs/2302.07488v1,http://arxiv.org/pdf/2302.07488v1
2302.07220v1,Kähler structures for holomorphic submersions,Chi Li,2023-02-14,http://arxiv.org/abs/2302.07220v1,http://arxiv.org/pdf/2302.07220v1
2302.07314v2,The Riemannian and symplectic geometry of the space of generalized Kähler structures,"Vestislav Apostolov, Jeffrey Streets, Yury Ustinovskiy",2023-02-14,http://arxiv.org/abs/2302.07314v2,http://arxiv.org/pdf/2302.07314v2
2302.05827v2,"Cosymplectic geometry, reductions, and energy-momentum methods with applications","J. de Lucas, A. Maskalaniec, B. M. Zawora",2023-02-12,http://arxiv.org/abs/2302.05827v2,http://arxiv.org/pdf/2302.05827v2
2302.04036v1,Derived Symplectic Reduction and L-Equivariant Geometry,Albin Grataloup,2023-02-08,http://arxiv.org/abs/2302.04036v1,http://arxiv.org/pdf/2302.04036v1
2302.02512v2,Mean Curvature Flows of Two-Convex Lagrangians,"Chung-Jun Tsai, Mao-Pei Tsui, Mu-Tao Wang",2023-02-06,http://arxiv.org/abs/2302.02512v2,http://arxiv.org/pdf/2302.02512v2
2302.01933v2,"Weak $(p,k)$-Dirac manifolds","Yanhui Bi, Zhixiong Chen",2023-02-05,http://arxiv.org/abs/2302.01933v2,http://arxiv.org/pdf/2302.01933v2
2302.02421v1,Abelianization and the Duistermaat-Heckman theorem,"Peter Crooks, Jonathan Weitsman",2023-02-05,http://arxiv.org/abs/2302.02421v1,http://arxiv.org/pdf/2302.02421v1
2302.02062v1,Normal forms for principal Poisson Hamiltonian spaces,"Pedro Frejlich, Ioan Marcut",2023-02-04,http://arxiv.org/abs/2302.02062v1,http://arxiv.org/pdf/2302.02062v1
2302.00334v1,Hamiltonian Classification of toric fibres and symmetric probes,Joé Brendel,2023-02-01,http://arxiv.org/abs/2302.00334v1,http://arxiv.org/pdf/2302.00334v1
2301.12544v1,The Poisson Geometry of Plancherel Formulas for Triangular Groups,Nicholas M. Ercolani,2023-01-29,http://arxiv.org/abs/2301.12544v1,http://arxiv.org/pdf/2301.12544v1
2301.12142v1,The moment map for the variety of associative algebras,"Hui Zhang, Zaili Yan",2023-01-28,http://arxiv.org/abs/2301.12142v1,http://arxiv.org/pdf/2301.12142v1
2302.01294v2,The weak Lie 2-algebra of multiplicative forms on a quasi-Poisson groupoid,"Zhuo Chen, Honglei Lang, Zhangju Liu",2023-01-27,http://arxiv.org/abs/2302.01294v2,http://arxiv.org/pdf/2302.01294v2
2301.10806v2,A moment map for the variety of Jordan algebras,"Claudio Gorodski, Iryna Kashuba, María Eugenia Martin",2023-01-25,http://arxiv.org/abs/2301.10806v2,http://arxiv.org/pdf/2301.10806v2
2301.08236v1,Harmonic metrics for the Hull-Strominger system and stability,"Mario Garcia-Fernandez, Raul Gonzalez Molina",2023-01-19,http://arxiv.org/abs/2301.08236v1,http://arxiv.org/pdf/2301.08236v1
2301.06912v3,Remarks on asymptotic isometric embeddings of conic transforms for torus actions,Andrea Galasso,2023-01-17,http://arxiv.org/abs/2301.06912v3,http://arxiv.org/pdf/2301.06912v3
2301.05594v1,Minimal $δ(2)$-ideal Lagrangian submanifolds and the Quaternionic projective space,"Kristof Dekimpe, Joeri Van der Veken, Luc Vrancken",2023-01-13,http://arxiv.org/abs/2301.05594v1,http://arxiv.org/pdf/2301.05594v1
